{
  "contract_version": "motion-preview-request/3.0",
  "target": {"kind": "album"},
  "profile_id": "youtube-1080p30-player-v1",
  "effects": {
    "pan_zoom": {"enabled": true, "max_zoom": 1.04, "path": "diagonal_down_right", "cycle_seconds": 180.0, "return_to_origin": true, "return_duration_seconds": 5.0, "easing": "smoothstep"},
    "audio_bars": {"enabled": true, "variation_mode": "organic_rms", "bar_count": 32, "color": "#FFFFFF", "opacity": 0.55, "placement": "bottom_center", "zone_width_px": 900, "zone_height_px": 110, "gap_px": 8, "horizontal_offset_px": 0, "bottom_margin_px": 242, "rms_window_samples": 1920, "attack_ms": 60.0, "release_ms": 240.0, "glow": {"enabled": true, "intensity": 0.25}},
    "player": {"contract_version": "player-overlay/1.0", "font": {"path": "fonts/Segoe UI.ttf", "metadata_size_px": 22, "timer_size_px": 20, "announcement_size_px": 36}, "footer": {"enabled": true, "height_px": 110, "background_color": "#101827", "opacity": 0.65}, "progress": {"enabled": true, "mode": "album", "thickness_px": 6, "fill_opacity": 0.8, "rail_opacity": 0.35}, "metadata": {"enabled": true, "bpm_key_policy": "prefer_reliable_analyzed_then_intended", "transition_seconds": 6.0}, "announcement": {"enabled": false, "fade_in_seconds": 0.5, "hold_seconds": 2.0, "fade_out_seconds": 0.5}, "theme": {"mode": "hybrid", "preset": "subtle", "overrides": {"footer_background": "#101827", "primary_text": null, "secondary_text": null, "progress_fill": null, "progress_rail": null, "visualizer": null}}}
  },
  "resolved_player": {
    "layout": {"layout_version": "wrld-player-layout/1.0", "safe_area": {"x": 64, "y": 64, "width": 1792, "height": 952}, "footer": {"x": 64, "y": 906, "width": 1792, "height": 110}, "progress_row": {"x": 76, "y": 918, "width": 1768, "height": 30}, "metadata_row": {"x": 76, "y": 964, "width": 1768, "height": 36}, "visualizer": {"x": 510, "y": 728, "width": 900, "height": 110}, "visualizer_glow": {"x": 474, "y": 692, "width": 972, "height": 182}, "announcement": {"x": 304, "y": 604, "width": 1312, "height": 64}},
    "theme": {"artwork_sha256": "aaaaaaaaaaaaaaaaaaaaaaaaaaaaaaaaaaaaaaaaaaaaaaaaaaaaaaaaaaaaaaaa", "palette_algorithm_version": "wrld-artwork-palette/1.0", "mode": "hybrid", "preset": "subtle", "dominant_color": "#334455", "colors": {"footer_background": "#101827", "primary_text": "#FFFFFF", "secondary_text": "#CCDDEE", "progress_fill": "#7799AA", "progress_rail": "#223344", "visualizer": "#88AABB"}, "provenance": {"footer_background": "manual", "primary_text": "derived", "secondary_text": "derived", "progress_fill": "artwork", "progress_rail": "derived", "visualizer": "artwork"}},
    "font_sha256": "bbbbbbbbbbbbbbbbbbbbbbbbbbbbbbbbbbbbbbbbbbbbbbbbbbbbbbbbbbbbbbbb",
    "display_tracks": [{"track_id": "track-01", "album_title": "Example Album", "track_title": "First Track", "bpm": "91.8", "bpm_provenance": "analyzed", "musical_key": "D minor", "key_provenance": "intended", "parent_channel": "WRLD-FI", "genre_channel": "World Music"}]
  },
  "excerpt": {"start_sample": 0, "sample_count": 720000}
}
